ID;Format;Title;Author_1;Author_2;Author_3;Author_4;Author_5;Author_Count;Journal_Name;Journal_Volume;Journal_Issue;Submission_Protocol;IPA;Data_Collection;Submission_Final;Review_Result;Submission_Revised;Submission_Acceptance;Publication;DOI;RR_Files;Additional_Links;Acceptance_Known;Pub_Year
766576;CR;Large-scale functional network reorganization in 22q11.2 deletion syndrome revealed by modularity analysis;Scariati, E.;Schaer, M.;Karahanoglu, I.;Schneider, M.;Richiardi, J.;8;Cortex;82;;;;;24-8-2015;24-11-2015;16-2-2016;3-6-2016;20-6-2016;https://doi.org/10.1016/j.cortex.2016.06.004;;;TRUE;2016
932885;CR;Targeting alertness to improve cognition in older adults: A preliminary report of benefits in executive function and skill acquisition;van Vleet, T.M.;DeGutis, J.M.;Merzenich, M.M.;Simpson, G.V.;Zomet, A.;6;Cortex;82;;;;;22-7-2015;24-11-2015;23-1-2016;20-5-2016;2-6-2016;https://doi.org/10.1016/j.cortex.2016.05.015;;;TRUE;2016
418067;CR;Tool use disorders in neurodegenerative diseases: Roles of semantic memory and technical reasoning;Baumard, J.;Lesourd, M.;Jarry, C.;Merck, C.;Etcharry-Bouyx, F.;11;Cortex;82;;;;;19-2-2016;29-3-2016;24-5-2016;12-6-2016;21-6-2016;https://doi.org/10.1016/j.cortex.2016.06.007;;;TRUE;2016
982923;CR;Meta-analytical and electrophysiological evidence for executive dysfunction in primary dystonia;Lange, F.;Seer, C.;Salchow, C.;Dengler, R.;Dressler, D.;6;Cortex;82;;;;;2-12-2015;27-3-2016;11-4-2016;30-5-2016;8-6-2016;https://doi.org/10.1016/j.cortex.2016.05.018;;;TRUE;2016
355625;CR;Thematic knowledge, artifact concepts, and the left posterior temporal lobe: Where action and object semantics converge;Kalenine, S.;Buxbaum, L.J.;;;;2;Cortex;82;;;;;10-12-2015;28-1-2016;21-1-2016;11-6-2016;23-6-2016;https://doi.org/10.1016/j.cortex.2016.06.008;;;TRUE;2016
179722;CR;Amygdala atrophy affects emotion-related activity in face-responsive regions in frontotemporal degeneration;de Winter, F-L.;van den Stock, J.;de Gelder, B.;Peeters, R.;Vandenbulcke, M.;9;Cortex;82;;;;;3-2-2016;14-3-2016;11-5-2016;1-6-2016;8-6-2016;https://doi.org/10.1016/j.cortex.2016.06.001;;;TRUE;2016
4132;CR;Convergent evidence for hierarchical prediction networks from human electrocorticography and magnetoencephalography;Phillips, H.N.;Blenkmann, A.;Hughes, L.E.;Kochen, S.;Bekinschtein, T.A.;7;Cortex;82;;;;;9-10-2015;6-2-2016;8-3-2016;2-5-2016;10-5-2016;https://doi.org/10.1016/j.cortex.2016.05.001;;;TRUE;2016
944614;CR;Apolipoprotein ?4 breaks the association between declarative long-term memory and memory-based orienting of spatial attention in middle-aged individuals;Salvato, G.;Patai, E.Z.;McCloud, T.;Nobre, A.C.;;4;Cortex;82;;;;;25-3-2016;24-5-2016;5-6-2016;6-6-2016;13-6-2016;https://doi.org/10.1016/j.cortex.2016.06.002;;;TRUE;2016
36501;CR;Ventral striatal hyperconnectivity during rewarded interference control in adolescents with ADHD;Mia, I.;van Holstein, M.;Mies, G.W.;Mennes, M.;Buitelaar, J.;9;Cortex;82;;;;;16-12-2015;2-2-2016;22-2-2016;25-5-2016;23-6-2016;https://doi.org/10.1016/j.cortex.2016.05.021;;;TRUE;2016
495599;CR;Gender differences in non-standard mapping tasks: A kinematic study using pantomimed reach-to-grasp actions;Copley-Mills, F.;Connolly, J.D.;Cavina-Pratesi, C.;;;3;Cortex;82;;;;;23-9-2015;16-11-2015;5-3-2016;10-6-2016;27-6-2016;https://doi.org/10.1016/j.cortex.2016.06.009;;;TRUE;2016
758554;CR;Emotion recognition deficits associated with ventromedial prefrontal cortex lesions are improved by gaze manipulation;Wolf, R.C.;Pujara, M.;Baskaya, M.K.;Koenigs, M.;;4;Cortex;82;;;;;7-3-2016;29-4-2016;16-5-2016;20-6-2016;29-6-2016;https://doi.org/10.1016/j.cortex.2016.06.017;;;TRUE;2016
246783;CR;Trans-saccadic interactions in human parietal and occipital cortex during the retention and comparison of object orientation;Dunkley, B.T.;Baltaretu, B.;Crawford, J.D.;;;3;Cortex;82;;;;;2-11-2015;13-3-2016;21-5-2016;15-6-2016;24-6-2016;https://doi.org/10.1016/j.cortex.2016.06.012;;;TRUE;2016
161673;CR;Alterations in conflict monitoring are related to functional connectivity in Parkinsons disease;Rosenberg-Katz, K.;Maidan, I.;Jacob, Y.;Giladi, N.;Mirelman, A.;6;Cortex;82;;;;;27-3-2016;12-5-2016;2-6-2016;16-6-2016;24-6-2016;https://doi.org/10.1016/j.cortex.2016.06.014;;;TRUE;2016
364414;RR;Probing the role of the vestibular system in motivation and reward-based attention;Blini, E.;Tilikete, C.;Farne, A.;Hadj-Bouziane, F.;;4;Cortex;103;;12-1-2017;2-6-2017;;5-12-2017;29-1-2018;7-2-2018;7-2-2018;27-2-2018;https://doi.org/10.1016/j.cortex.2018.02.009;;;TRUE;2018
425181;CR;Motor-evoked potentials reveal functional differences between dominant and non-dominant motor cortices during response preparation;Poole, B.J.;Mather, M.;Livesey, E.J.;Harris, I.M.;Harris, J.A.;5;Cortex;103;;;;;17-10-2017;11-12-2017;19-12-2017;2-2-2018;21-2-2018;https://doi.org/10.1016/j.cortex.2018.02.004;;;TRUE;2018
570571;CR;Autistic adults show preserved normalisation of sensory responses in gaze processing;Palmer, C.J.;Lawson, R.P.;Shankar, S.;Clifford, C.W.G.;Rees, G.;5;Cortex;103;;;;;19-9-2017;27-1-2018;29-1-2018;9-2-2018;21-2-2018;https://doi.org/10.1016/j.cortex.2018.02.005;;;TRUE;2018
381033;CR;Cortical responses to dynamic emotional facial expressions generalize across stimuli, and are sensitive to task-relevance, in adults with and without Autism;Kliemann, D.;Richardson, H.;Anzellotti,;Ayyash, D.;Haskins, A.J.;7;Cortex;103;;;;;9-9-2017;29-10-2017;11-1-2018;8-2-2018;21-2-2018;https://doi.org/10.1016/j.cortex.2018.02.006;;;TRUE;2018
226659;CR;Facilitation of motor excitability during listening to spoken sentences is not modulated by noise or semantic coherence;Panouilleres, M.T.N.;Boyles, R.;Chesters, J.;Watkins, K.E.;Mottonen, R.;5;Cortex;103;;;;;26-7-2017;31-8-2017;27-11-2017;8-2-2018;22-2-2018;https://doi.org/10.1016/j.cortex.2018.02.007;;;TRUE;2018
628617;CR;Functional interplay of top-down attention with affective codes during visual short-term memory maintenance;Kuo, B-C.;Lin, S-H.;Y, Y-Y,;;;3;Cortex;103;;;;;12-7-2017;23-8-2017;21-10-2017;7-2-2018;21-2-2018;https://doi.org/10.1016/j.cortex.2018.02.003;;;TRUE;2018
976330;CR;TMS over the supramarginal gyrus delays selection of appropriate grasp orientation during reaching and grasping tools for use;McDowell, T.;Holmes, N.P.;Sunderland, A.;Schuermann, M.;;4;Cortex;103;;;;;4-8-2017;16-11-2017;16-1-2018;1-3-2018;9-3-2018;https://doi.org/10.1016/j.cortex.2018.03.002;;;TRUE;2018
702322;CR;Sounds from seeing silent motion: Who hears them, and what looks loudest?;Fassnidge, C.J.;Freeman, E.D;;;;2;Cortex;103;;;;;24-10-2017;5-12-2017;16-1-2018;23-2-2018;9-3-2018;https://doi.org/10.1016/j.cortex.2018.02.019;;;TRUE;2018
54416;CR;Variations in response control within at-risk gamblers and non-gambling controls explained by GABAergic inhibition in the motor cortex;Chowdhury, N.S.;Livesey, E.J.;Blaszczynski, A.;Harris, J.A.;;4;Cortex;103;;;;;4-10-2017;5-2-2018;26-2-2018;2-3-2018;17-3-2018;https://doi.org/10.1016/j.cortex.2018.03.004;;;TRUE;2018
785825;CR;Learning for pitch and melody discrimination in congenital amusia;Whiteford, K.L.;Oxenham, A.J.;;;;2;Cortex;103;;;;;30-8-2017;8-11-2017;12-12-2017;8-3-2018;23-3-2018;https://doi.org/10.1016/j.cortex.2018.03.012;;;TRUE;2018
346217;CR;Supramodal agnosia for oblique mirror orientation in patients with periventricular leukomalacia;Castaldi, E.;Tinelli, F.;Cicchini, G.M.;Concetta, Morrone, M.;;4;Cortex;103;;;;;6-8-2017;22-1-2018;9-3-2018;12-3-2018;22-3-2018;https://doi.org/10.1016/j.cortex.2018.03.010;;;TRUE;2018
804732;CR;Patterns of neural response in face regions are predicted by low-level image properties;Weibert, K.;Flack T.R.;Young, A.W.;Andrews, T.J.;;4;Cortex;103;;;;;13-9-2017;2-11-2017;26-1-2018;13-3-2018;23-3-2018;https://doi.org/10.1016/j.cortex.2018.03.009;;;TRUE;2018
469230;CR;Influence of task instructions and stimuli on the neural network of face processing: An ALE meta-analysis;Mueller, V.I.;Hohner, Y.;Eickhoff, S.B.;;;3;Cortex;103;;;;;29-8-2017;18-10-2017;27-12-2017;9-3-2018;22-3-2018;https://doi.org/10.1016/j.cortex.2018.03.011;;;TRUE;2018
449723;CR;Simple dissociations for a higher-powered neuropsychology;McIntosh, R.D.;;;;;1;Cortex;103;;;;;10-12-2017;2-2-2018;16-3-2018;18-3-2018;27-3-2018;https://doi.org/10.1016/j.cortex.2018.03.015;;;TRUE;2018
1336;CR;MEG adaptation reveals action representations in posterior occipitotemporal regions;Hauswald, A.;Tucciarelli, R.;Lingnau, A.;;;3;Cortex;103;;;;;5-10-2017;25-11-2017;23-1-2018;17-3-2018;27-3-2018;https://doi.org/10.1016/j.cortex.2018.03.016;;;TRUE;2018
177825;CR;Visual texture agnosia in dementia with Lewy bodies and Alzheimers disease;Oishi, Y.;Imamura, T.;Shimomura, T.;Suzuki, K.;;4;Cortex;103;;;;;9-6-2017;11-9-2017;10-11-2017;19-3-2018;27-3-2018;https://doi.org/10.1016/j.cortex.2018.03.018;;;TRUE;2018
808157;CR;Optimizing text for an individuals visual system: The contribution of visual crowding to reading difficulties;Joo, S.J.;White, A.L.;Strodtman, D.J.;Yeatman, J.D.;;4;Cortex;103;;;;;23-10-2017;6-12-2017;23-1-2018;1-3-2018;23-3-2018;https://doi.org/10.1016/j.cortex.2018.03.013;;;TRUE;2018
844682;CR;Knowledge about writing influences reading: Dynamic visual information about letter production facilitates letter identification;Schubert, T.;Reilhac, C.;McCloskey, M.;;;3;Cortex;103;;;;;3-10-2017;4-1-2018;16-2-2018;21-3-2018;30-3-2018;https://doi.org/10.1016/j.cortex.2018.03.020;;;TRUE;2018
511466;CR;Shedding new light on disorders of consciousness diagnosis: The dynamic functional connectivity;Naro, A.;Bramanti, A.;Leo, A.;Cacciola, A.;Calabro, R.S;7;Cortex;103;;;;;27-11-2017;2-2-2018;23-2-2018;28-3-2018;4-4-2018;https://doi.org/10.1016/j.cortex.2018.03.029;;;TRUE;2018
930740;CR;Dynamic semantic cognition: Characterising coherent and controlled conceptual retrieval through time using magnetoencephalography and chronometric transcranial magnetic stimulation;Teige, C.;Mollo, G.;Millmann, R.;Savill, N.;Jefferries, E.;7;Cortex;103;;;;;19-7-2017;16-11-2017;24-1-2018;20-3-2018;30-3-2018;https://doi.org/10.1016/j.cortex.2018.03.024;;;TRUE;2018
841841;CR;Neural networks supporting audiovisual integration for speech: A large-scale lesion study;Hickok, G.;Rogalsky, C.;Matchin, W.;Basilakos, A.;Cai, J.;12;Cortex;103;;;;;27-9-2017;18-11-2017;5-12-2017;23-3-2018;10-4-2018;https://doi.org/10.1016/j.cortex.2018.03.030;;;TRUE;2018
808770;RR;Role of features and categories in the organization of object knowledge: Evidence from adaptation fMRI;Ging, J.;Schnur, T.T.;;;;2;Cortex;78;;17-2-2014;21-10-2014;;5-5-2015;13-7-2015;11-12-2015;5-1-2016;6-2-2016;https://doi.org/10.1016/j.cortex.2016.01.006;;;TRUE;2016
98345;CR;Expectations impact short-term memory through changes in connectivity between attention- and task-related brain regions;Sinke, C.;Forkmann, K.;Schmidt, K.;Wiech, K.;Bingel, U.;5;Cortex;78;;;;;6-10-2015;14-11-2015;8-12-2015;6-2-2016;17-2-2016;https://doi.org/10.1016/j.cortex.2016.02.008;;;TRUE;2016
47698;CR;Canceled connections: Lesion-derived network mapping helps explain differences in performance on a complex decision-making task;Sutterer, M.J.;Bruss, J.;Boes, A.D.;Voss, M.W.;Bechara, A.;6;Cortex;78;;;;;18-9-2015;23-11-2015;19-1-2016;3-2-2016;21-2-2016;https://doi.org/10.1016/j.cortex.2016.02.002;;;TRUE;2016
818538;CR;A third-person perspective on co-speech action gestures in Parkinsons disease;Humphries, S.;Holler, J.;Crawford, T.J.;Herrera, E.;Poliakoff, E.;5;Cortex;78;;;;;6-8-2015;18-9-2015;14-12-2015;13-2-2016;27-2-2016;https://doi.org/10.1016/j.cortex.2016.02.009;;;TRUE;2016
949657;CR;Forgetting in temporal lobe epilepsy: When does it become accelerated?;Cassel, A.;Morris, R.;Koutroumanidis, M.;Kopelman, M.;;4;Cortex;78;;;;;31-8-2015;30-10-2015;5-1-2016;8-2-2016;24-2-2016;https://doi.org/10.1016/j.cortex.2016.02.005;;;TRUE;2016
114087;CR;Cross-modal transfer of statistical information benefits from sleep;Durrant, S.J.;Cairney, S.A.;Lewis, P.A.;;;3;Cortex;78;;;;;28-9-2015;24-11-2015;23-1-2016;17-2-2016;27-2-2016;https://doi.org/10.1016/j.cortex.2016.02.011;;;TRUE;2016
863158;CR;Mirrored and rotated stimuli are not the same: A neuropsychological and lesion mapping study;Martinaud, O.;Mirlink, N.;Bioux, S.;Bliaux, e.;Champmartin, C.;9;Cortex;78;;;;;27-9-2015;17-12-2015;30-1-2016;1-3-2016;11-3-2016;https://doi.org/10.1016/j.cortex.2016.03.002;;;TRUE;2016
838945;CR;Contralesional distractors enhance ipsilesional target processing after right-hemispheric stroke;Vossel, S.;Fink, G.R.;;;;2;Cortex;78;;;;;11-9-2015;27-10-2015;4-1-2016;10-2-2016;27-2-2016;https://doi.org/10.1016/j.cortex.2016.02.010;;;TRUE;2016
992126;CR;Structural brain correlates of defective gesture performance in schizophrenia;Stegmayer, K.;Bohlhalter, S.;Vanbellingen, T.;Federspeil, A.;Walther, S.;9;Cortex;78;;;;;16-6-2015;24-8-2015;12-10-2015;27-2-2016;10-3-2016;https://doi.org/10.1016/j.cortex.2016.02.014;;;TRUE;2016
538792;CR;Interhemispheric inhibition is dynamically regulated during action observation;Gueugneau, N.;Bove, M.;Ballay, Y.;Papaxanthis, C.;;4;Cortex;78;;;;;18-6-2015;8-11-2015;10-2-2016;1-3-2016;10-3-2016;https://doi.org/10.1016/j.cortex.2016.03.003;;;TRUE;2016
929021;RR;The effects of AMPA blockade on the spectral profile of human early visual cortex recordings studied with non-invasive MEG;Muthukumaraswamy, S.D.;Routley, B.;Droog, W.;Sigh, K.D.;Hamandi, K.;5;Cortex;81;;30-7-2013;2-12-2013;;1-9-2015;16-10-2015;26-11-2015;2-3-2016;31-3-2016;https://doi.org/10.1016/j.cortex.2016.03.004;;;TRUE;2016
339372;CR;Object representations in visual working memory change according to the task context;Balaban, H.;Luria, R.;;;;2;Cortex;81;;;;;19-10-2015;7-1-2016;3-2-2016;4-4-2016;13-4-2016;https://doi.org/10.1016/j.cortex.2016.04.004;;;TRUE;2016
286965;CR;Resilience to the contralateral visual field bias as a window into object representations;Garcea, F.E.;Kristensen, S.;Almeida, J.;Mahon, B.Z.;;4;Cortex;81;;;;;17-11-2015;18-1-2016;4-3-2016;4-4-2016;13-4-2016;https://doi.org/10.1016/j.cortex.2016.04.006;;;TRUE;2016
925718;CR;Attentional bias towards and away from fearful faces is modulated by developmental amygdala damage;Pishnamazi, M.;Tafakhorri, A.;Loloee, S.;Modabbernia, A.;Aghamollaii, V.;7;Cortex;81;;;;;14-8-2015;11-11-2015;19-1-2016;10-4-2016;22-4-2016;https://doi.org/10.1016/j.cortex.2016.04.012;;;TRUE;2016
869231;CR;The experiential blink: Mapping the cost of working memory encoding onto conscious perception in the attentional blink;Pincham, H.L.;Bowman, H.;Szucs, D.;;;3;Cortex;81;;;;;10-7-2015;20-10-2015;29-1-2016;8-4-2016;21-4-2016;https://doi.org/10.1016/j.cortex.2016.04.007;;;TRUE;2016
939309;CR;Increased ongoing neural variability in ADHD;Gonen-Yaacovi, G.;Arazi, A.;Shahar, N.;Karmon, A.;Dinstein, I.;7;Cortex;81;;;;;23-7-2015;14-11-2015;31-12-2015;7-4-2016;21-4-2016;https://doi.org/10.1016/j.cortex.2016.04.010;;;TRUE;2016
240172;CR;Reduced sensitivity to contrast signals from the eye region in developmental prosopagnosia;Fisher, K.;Towler, J.;Eimer, M.;;;3;Cortex;81;;;;;25-1-2016;4-3-2016;19-3-2016;4-4-2016;13-4-2016;https://doi.org/10.1016/j.cortex.2016.04.005;;;TRUE;2016
969169;CR;A general magnitude system in human adults: Evidence from a subliminal priming paradigm;Lourenco, S.F.;Ayzenberg, V.;Lyu, J.;;;3;Cortex;81;;;;;26-11-2015;31-12-2015;1-4-2016;3-4-2016;26-4-2016;https://doi.org/10.1016/j.cortex.2016.04.013;;;TRUE;2016
859716;CR;Resting state functional connectivity of the hippocampus along the anterior?posterior axis and its association with glutamatergic metabolism;Wagner, G.;Gussew, A.;Kohler, S.;de la Cruz, F.;Smesny, S.;7;Cortex;81;;;;;23-10-2015;16-12-2015;29-2-2016;30-3-2016;22-4-2016;https://doi.org/10.1016/j.cortex.2016.03.022;;;TRUE;2016
574389;CR;Perception of hand movement by mirror reflection evokes brain activation in the motor cortex contralateral to a non-moving hand;Debnath, R.;Franz, E.A.;;;;2;Cortex;81;;;;;21-8-2015;13-10-2015;18-12-2015;20-4-2016;27-4-2016;https://doi.org/10.1016/j.cortex.2016.04.015;;;TRUE;2016
851743;CR;Impaired perception of facial emotion in developmental prosopagnosia;Biotti, F.;Cook, R.;;;;2;Cortex;81;;;;;18-12-2015;8-2-2016;3-3-2016;8-4-2016;21-4-2016;https://doi.org/10.1016/j.cortex.2016.04.008;;;TRUE;2016
397673;CR;Identifying grey matter changes in schizotypy using partial least squares correlation;Wiebels, K.;Waldie, K.E.;Roberts, R.P.;Park, H.R.P.;;4;Cortex;81;;;;;11-12-2015;2-2-2016;31-3-2016;10-4-2016;22-4-2016;https://doi.org/10.1016/j.cortex.2016.04.011;;;TRUE;2016
988132;CR;The superior colliculus is sensitive to gestalt-like stimulus configuration in hemispherectomy patients;Georgy, L.;Celghin, A.;Marzi, C.;Tamietto, M.;Ptito, A.;5;Cortex;81;;;;;2-11-2015;31-1-2016;4-3-2016;22-4-2016;1-5-2016;https://doi.org/10.1016/j.cortex.2016.04.018;;;TRUE;2016
948960;CR;The blink reflex magnitude is continuously adjusted according to both current and predicted stimulus position with respect to the face;Wallwork, S.B.;Talbot, K.;Camfferman, D.;Moseley, G.L.;Iannetti, G.D.;5;Cortex;81;;;;;14-10-2015;5-2-2016;1-3-2016;9-4-2016;22-4-2016;https://doi.org/10.1016/j.cortex.2016.04.009;;;TRUE;2016
108859;CR;Social representations and contextual adjustments as two distinct components of the Theory of Mind brain network: Evidence from the REMICS task;Lavoie, M-A.;Vistoli, D.;Sutliff, S.;Jackson, P.L.;Achim, A.M.;5;Cortex;81;;;;;30-6-2015;16-3-2016;22-4-2016;2-5-2016;18-12-2015;https://doi.org/10.1016/j.cortex.2016.04.017;;;TRUE;2015
835408;CR;Differential compromise of prospective and retrospective metamemory monitoring and their dissociable structural brain correlates;le Berre, A-P.;Mueller-Oehring, E.M.;Kwon, D.;Serventi, M.R.;Sullivan E.V.;6;Cortex;81;;;;;16-1-2016;30-3-2016;5-4-2016;4-5-2016;15-5-2016;https://doi.org/10.1016/j.cortex.2016.05.002;;;TRUE;2016
149339;CR;Internal modeling of upcoming speech: A causal role of the right posterior cerebellum in non-motor aspects of language production;Runnqvist, E.;Bonnard, M.;Gauvin, H.S.;Attarian, S.;Trebuchon, A.;7;Cortex;81;;;;;5-2-2016;18-3-2016;18-4-2016;12-5-2016;21-5-2016;https://doi.org/10.1016/j.cortex.2016.05.008;;;TRUE;2016
622703;CR;Neural mechanisms of goal-contingent task disengagement: Response-irrelevant stimuli activate the default mode network;Anderson, B.A.;Folk, C.L.;Courtney, S.M.;;;3;Cortex;81;;;;;26-9-2015;15-12-2015;2-2-2016;9-5-2016;21-5-2016;https://doi.org/10.1016/j.cortex.2016.05.006;;;TRUE;2016
909724;CR;Prefrontal activity during working memory is modulated by the interaction of variation in CB1 and COX2 coding genes and correlates with frequency of cannabis use;Taurisano, P.;Antoncci, L.A.;Fazio, L.;Rampino, A.;Bertolino, A.;14;Cortex;81;;;;;11-11-2015;4-3-2016;19-4-2016;13-5-2016;21-5-2016;https://doi.org/10.1016/j.cortex.2016.05.010;;;TRUE;2016
222015;CR;Default mode network differences between rigidity- and tremor-predominant Parkinsons disease;Karunanayaka, P.R.;Lee, E-Y.;Lewis, M.M.;Sen, S.;Eslinger, P.J.;7;Cortex;81;;;;;28-5-2015;8-7-2015;8-9-2015;22-4-2016;6-5-2016;https://doi.org/10.1016/j.cortex.2016.04.021;;;TRUE;2016
756289;CR;Seeing the eyes in acquired prosopagnosia;Pancaroglu, R.;Hills, C.S.;Sekunova, A.;Viswanathan, J.;Duchaine, B.;6;Cortex;81;;;;;24-7-2015;6-11-2015;18-1-2016;24-4-2016;24-5-2016;https://doi.org/10.1016/j.cortex.2016.04.024;;;TRUE;2016
868974;RR;The functional subdivision of the visual brain: Is there a real illusion effect on action? A multi-lab replication study;Kopiske, K.K.;Bruno, N.;Hesse, C.;Schenk, T.;Franz, V.H.;5;Cortex;79;;11-3-2014;2-9-2014;;29-9-2015;12-12-2015;10-2-2016;14-3-2016;6-4-2016;https://doi.org/10.1016/j.cortex.2016.03.020;;;TRUE;2016
409342;CR;The ?when? and ?where? of semantic coding in the anterior temporal lobe: Temporal representational similarity analysis of electrocorticogram data;Chen, Y.;Shimotake, A.;Matsumoto, R.;Kunieda, T.;Kikuchi, T.;10;Cortex;79;;;;;1-7-2015;20-9-2015;18-12-2015;1-3-2016;16-3-2016;https://doi.org/10.1016/j.cortex.2016.02.015;;;TRUE;2016
435195;CR;Novel word acquisition in aphasia: Facing the word-referent ambiguity of natural language learning contexts;Penaloza, C.;Mirman, D.;Touomiranta, L.;Benetello, A.;Rodriguez-Fornells, A.;12;Cortex;79;;;;;2-2-2015;8-5-2015;6-8-2015;9-3-2016;19-3-2016;https://doi.org/10.1016/j.cortex.2016.03.009;;;TRUE;2016
253533;CR;Memory-guided reaching in a patient with visual hemiagnosia;Cornelsen, S.;Rennig, J.;Himmelbach, M.;;;3;Cortex;79;;;;;25-6-2015;13-10-2015;15-1-2016;8-3-2016;22-3-2016;https://doi.org/10.1016/j.cortex.2016.03.010;;;TRUE;2016
762862;CR;Central perception of position sense involves a distributed neural network ? Evidence from lesion-behavior analyses;Findlater, S.E.;Desai, J.A.;Semrau, J.A.;Kenzie, J.M.;Dukelow, S.P.;8;Cortex;79;;;;;24-4-2015;7-8-2015;2-11-2015;8-3-2016;18-3-2016;https://doi.org/10.1016/j.cortex.2016.03.008;;;TRUE;2016
658250;CR;An fMRI study investigating effects of conceptually related sentences on the perception of degraded speech;Guediche, S.;Reilly, M.;Santiago, C.;Laurent, P.;Blumstein, S.E.;5;Cortex;79;;;;;4-6-2015;6-9-2015;6-1-2016;15-3-2016;15-3-2016;https://doi.org/10.1016/j.cortex.2016.03.014;;;TRUE;2016
248331;CR;The anterior temporal cortex is a primary semantic source of top-down influences on object recognition;Chiou, R.;Lambon Ralph, M.A.;;;;2;Cortex;79;;;;;25-9-2015;8-12-2015;1-2-2015;9-3-2016;18-3-2016;https://doi.org/10.1016/j.cortex.2016.03.007;;;TRUE;2016
559644;CR;The neural origins of visual crowding as revealed by event-related potentials and oscillatory dynamics;Ronconi, L.;Bertoni, S.;Bellacosa Marotti, R.;;;3;Cortex;79;;;;;7-7-2015;24-9-2015;20-11-2015;2-3-2016;16-3-2016;https://doi.org/10.1016/j.cortex.2016.03.005;;;TRUE;2016
363967;CR;Neural pattern similarity underlies the mnemonic advantages for living words;Xiao, X.;Dong, Q.;Chen, C.;Xue, G.;;4;Cortex;79;;;;;15-7-2015;24-11-2015;8-1-2016;16-3-2016;31-3-2016;https://doi.org/10.1016/j.cortex.2016.03.016;;;TRUE;2016
79132;CR;No evidence for blocking the return of fear by disrupting reconsolidation prior to extinction learning;Klucken, T.;Kruse, O.;Schweckendiek, J.;Kuepper, Y.;Mueller, E.M.;7;Cortex;79;;;;;3-6-2015;10-7-2015;4-10-2015;16-3-2016;24-3-2016;https://doi.org/10.1016/j.cortex.2016.03.015;;;TRUE;2016
100366;RR;The misattribution of emotions and the error-related negativity: A registered report;Elkins-Brown, N.;Saunders, B.;Inzlicht, M.;;;3;Cortex;109;;19-10-2016;6-1-2017;;21-6-2018;22-6-2018;23-6-2018;20-8-2018;7-9-2018;https://doi.org/10.1016/j.cortex.2018.08.017;;;TRUE;2018
584279;CR;Trauma exposure acutely alters neural function during Pavlovian fear conditioning;Harnett, N.G;Ference, E.W.;Wood, K.H.;Wheelock, M.D.;Knight, D.C.;6;Cortex;109;;;;;28-3-2018;21-5-2018;29-6-2018;22-8-2018;1-9-2018;https://doi.org/10.1016/j.cortex.2018.08.015;;;TRUE;2018
305183;CR;The left temporal pole is a convergence region mediating the relation between names and semantic knowledge for unique entities: Further evidence from a ?recognition-from-name? study in neurological patients;Schneider, B.;Heskje, J.;Tranel, D.;Belfi, A.M.;;4;Cortex;109;;;;;20-3-2018;14-6-2018;17-7-2018;30-8-2018;10-9-2018;https://doi.org/10.1016/j.cortex.2018.08.026;;;TRUE;2018
141276;CR;Adolescents with autism show typical fMRI repetition suppression, but atypical surprise response;Utzerath, C.;Schmits, I.C.;Buitelaar, J.;de Lange, F.P.;;4;Cortex;109;;;;;5-12-2017;4-4-2018;15-6-2018;27-8-2018;8-9-2018;https://doi.org/10.1016/j.cortex.2018.08.019;;;TRUE;2018
194849;CR;One versus two eyes makes a difference! Early face perception is modulated by featural fixation and feature context;Parkington, K.B.;Itier, R.J.;;;;2;Cortex;109;;;;;13-12-2017;11-5-2018;11-7-2018;30-8-2018;8-9-2018;https://doi.org/10.1016/j.cortex.2018.08.025;;;TRUE;2018
272210;CR;Visuomotor learning and unlearning in children and adolescents with tourette syndrome;Kim, S.;Jackson, S.R.;Groom, M.;Jackson, G.M.;;4;Cortex;109;;;;;17-4-2018;19-7-2018;25-7-2018;2-8-2019;11-9-2018;https://doi.org/10.1016/j.cortex.2018.08.007;;;TRUE;2018
318987;CR;Modulation of associative learning in the hippocampal-striatal circuit based on item-set similarity;Stark, S.M.;Frithsen, A.;Mattfeld, A.T.;Stark, C.E.L.;;4;Cortex;109;;;;;9-3-2018;18-5-2018;15-5-2018;29-8-2018;18-9-2018;https://doi.org/10.1016/j.cortex.2018.08.035;;;TRUE;2018
293723;CR;Interhemispheric interactions during sentence comprehension in patients with aphasia;Chu, R.;Meltzer, J.A.;Bitan, T.;;;3;Cortex;109;;;;;5-10-2017;7-2-2018;3-5-2018;28-8-2018;11-9-2018;https://doi.org/10.1016/j.cortex.2018.08.022;;;TRUE;2018
505568;CR;Enhanced deviant responses in patterned relative to random sound sequences;Southwell, R.;Chait, M.;;;;2;Cortex;109;;;;;20-6-2018;23-7-2018;15-8-2018;26-8-2018;14-9-2018;https://doi.org/10.1016/j.cortex.2018.08.032;;;TRUE;2018
684174;CR;Attenuating anger and aggression with neuromodulation of the vmPFC: A simultaneous tDCS-fMRI study;Gilam, G.;Abend, R.;Gurevitch, G.;Erdman, A.;Baker, H.;7;Cortex;109;;;;;7-6-2018;25-7-2018;20-8-2018;13-9-2018;27-9-2018;https://doi.org/10.1016/j.cortex.2018.09.010;;;TRUE;2018
504175;CR;Classical paintings may trigger pain and pleasure in the gendered brain;de Gelder, B.;Watson, R.;Zhan, M.;Diano, M.;Tamietto, M.;6;Cortex;109;;;;;20-2-2018;31-5-2018;12-7-2018;18-9-2018;28-9-2018;https://doi.org/10.1016/j.cortex.2018.09.011;;;TRUE;2018
541897;CR;Rest on it: Awake quiescence facilitates insight;Craig, M.;Ottaway, G.;Dewar, M.;;;3;Cortex;109;;;;;21-5-2018;6-7-2018;28-8-2018;13-9-2018;27-9-2018;https://doi.org/10.1016/j.cortex.2018.09.009;;;TRUE;2018
693697;CR;Bi-cephalic parietal and cerebellar direct current stimulation interferes with early error correction in prism adaptation: Toward a complex view of the neural mechanisms underlying visuomotor control;Panico, F.;Sagliano, F.;Grossi, D.;Trojano, L.;;4;Cortex;109;;;;;10-4-2018;29-5-2018;19-6-2018;17-9-2018;11-10-2018;https://doi.org/10.1016/j.cortex.2018.09.020;;;TRUE;2018
